Title,Database,Year,Month,Journal,Paper Type,Data Source,Data Country,Data Domain,Data Language,Data Availability,Link to Data,Data Details,Size,Number of Prompts,Medical Application,Task Type,Topic,Note,Bias Evaluation Metric,Bias Definition,Conclusions,Race / Ethnic Bias,Language Bias,Age Bias,Gender Bias,Other Bias,LGBTQ+ Bias,Disability Bias,Geography / Cultural Bias,Evaluated LLMs,"Reference Standard 
(Human / Model / System / Physician)","Patient Inclusion
(Yes / No)",Has Debiasing,"Debias - Focus
(Data/Train/Inference)",Debias-details
Unveiling Performance Challenges of Large Language Models in Low-Resource Healthcare: A Demographic Fairness Perspective,ACL,2025,January,Proceedings of the 31st International Conference on Computational Linguistics,Experiment on Existing Models,"MEDQA,MIMIC-IV",USA,Bio-Med,English,"Open Source, Couldn't Find",,"Some datasets contained data on contains transcribed interactions between a trained clinician and outpatients with schizophrenia, bipolar disorder, and healthy controls. Others contained multiple-choice medical problems collected from medical board exams",17255,Unclear,"Knowledge QA, Diagnosis, Other (predicting patient outcomes)","Text Generation, Classification",Evaluating bias in performance of Healthcare LLMs,Explicitly prompting LLMs with demographic information does not necessarily improve performance. The impact varies depending on both the specific task and the LLM used.,Demographic Parity Difference (PDP) and Equal Opportunity Difference (EOD),Demographic Parity Difference (PDP) and Equal Opportunity Difference (EOD),"African American: Yes, White: No, Female: Yes, Male: Yes","Yes(african american,white)",No,No,"Yes(female,male)",No,No,No,No,"COT-ChatGPT-4,COT-Claude-3,COT-LLaMA-3 60 56 52 66
SFT-LoRA,Agent-ChatGPT-4",System,No,Yes,Inference,"Researchers tried different prompting techniques, like Zero-Shot Chain of Thought, N-shot CoT/"
Gender-Neutral Large Language Models for Medical Applications: Reducing Bias in PubMed Abstracts,ACL,2025,August,Proceedings of the 24th Workshop on Biomedical Language Processing,"Experiment on Existing Models, Experiment on New Models","379,000 PubMed abstracts",None,Bio-Med,NA,Open Source,,Each data point is a abstract from PubMed's database of papers.,750,Unclear,Other (Bias Mitigation),Other (Output vector embeddings),Propose a novel approach to mitigate gender bias in LLMs used in medical contexts.,"In each sentence, a [MASK] token was inserted in place of a pronoun, and the model was tasked with predicting the correct pronoun when given respective options of ‘he/him/his,’ ‘she/her/hers,’ and ‘they/them/theirs.’.... Augmented datasets improved both accuracy and fairness in classification tasks.","Accuracy in identifying antecedents, accuracy in predicting pronouns",Differences in the aforementioned metrics,"Women: No, Men: No",No,No,No,"Yes(female,male)",No,No,No,No,"BERT-Base, PubMedBERT, MOBERT, 1965BERT",System,No,Yes,Data,Researchers neutered the gendered pronouns in abstracts and trained a model on the new data.
Unlocking LLMs: Addressing Scarce Data and Bias Challenges in Mental Health and Therapeutic Counselling,ACL,2024,July,International Conference on Natural Language Processing and Artificial Intelligence for Cyber Security,"Benchmark or Dataset, Experiment on Existing Models",AnnoMI,NA,EHR,English,Open Source,,an expert-annotated GDPR-compliant dataset of 133 high- and low-quality MI sessions,133,Unclear,"Treatment, Other (Motivational interviewing)",Text Generation,Researchers used an existing dataset and ChatGPT to write synthetic data with human experts in the loop to create a larger and more balanced dataset called IC-AnnoMI for mental health LLMs.,"To maintain the integrity and quality of the data, qualified expert affiliated with the gold-standard organisation in psychology and MI have performed the annotations.","Balanced Accuracy, Accuracy, Precision, Recall, F1-score, psychological quality on 5 point Likert scale,","Difference in aforementioned metrics, class imbalance","Women: No, Men: No",No,No,No,"Yes(female,male)",No,No,No,No,"ChatGPT-4.0,ChatGPT-3.5-Turbo",Physician,No,Yes,"Data,Inference",They used a prompting technique called progressive prompting. Made the data more diverse and balanced. Kept the quality high by having humans in the loop
DiversityMedQA: A Benchmark for Assessing Demographic Biases in Medical Diagnosis using Large Language Models,ACL,2024,November,Proceedings of the Third Workshop on NLP for Positive Impact,"Experiment on Existing Models, Benchmark or Dataset",MedQA,NA,Bio-Med,English,Open Source,,"MedQA is a standardized collection
of medical questions from professional medical
board exams. Each data point is a medical question. ",1107,Unclear,Knowledge QA,Text Generation,"We introduce DiversityMedQA1 , a novel benchmark designed to assess LLM responses to medical queries across diverse patient demographics, such as gender and ethnicity","Most interesting finding: “After qualitative analysis, we noticed that certain words triggered differences in how the models answered questions. Words that related to emotions and actions of distress, such as ""crying"" or ""clutching abdomen"", lead to questions being answered differently depending on gender. This behavior is especially pervasive in the GPT3.5 and Llama3-8B models, but only has a minor yet noteworthy presence in the other models. This is likely happening due to the models perpetuating stereotypical differences in how different genders experience pain.”","Accuracy, Accuracy of majority vote of 5 iterations",Statistically significant differences in accuracy between identity groups found using Z-test.,"Male: No, Female: No, African: Yes, Asian: Yes, Caucasian: Yes, Hispanic: Yes, Native American: Yes","Yes(african,asian,caucasian,hispanic,native american)",No,No,"Yes(female,male)",No,No,No,No,"GPT-3.5 Turbo, GPT-4 Turbo, GPT-4o, Gemini 1.5 Flash, and Llama3-8B",System,No,No,None,None
Can LLMs Replace Clinical Doctors? Exploring Bias in Disease Diagnosis by Large Language Models,ACL,2024,November,Findings of the Association for Computational Linguistics: EMNLP 2024,"Experiment on Existing Models, Benchmark or Dataset","336,920 authentic medical records from a hospital",NA,EHR,NA,Couldn't Find,,Each data point is a medical record from a hospital.,"336,920",Unclear,Diagnosis,Classification,LLMs Show Systematic Biases in Diagnosis.,"Types of Bias: Gender Bias: GPT-4 and Qwen favored male diagnoses; ChatGPT favored female ones. Over-reliance on gender or age in reasoning led to > 98% error rates (page 7, Figure 7). Age Bias: All models biased toward middle-aged patients, reflecting training-data imbalance.","Accuracy, ratio of the number of predicted disease samples to the number of actual samples.","Disease diagnosis bias is characterized by the disproportionate weight given to certain dimensions of disease, resulting in an unfair skew. Bias in disease diagnosis on a particular dimension as a discrepancy in the model’s inclination towards different values of that dimension.","infant: Yes, children: Yes, teenager: Yes, youth: Yes, middle-aged: No, elderly: Yes, female: Yes, male: Yes",No,No,"Yes (infant, children, teenager, youth, middle-aged, elderly)","Yes(female, male)",No,No,No,No,"GPT-4,ChatGPT, Qwen1.5-72b",System,No,Yes,Inference,"Reseachers propose a technique which they call the Integrated Debiasing Diagnosis Method, which first makes the model provide output when not given any demographic information."
PersonaTwin: A Multi-Tier Prompt Conditioning Framework for Generating and Evaluating Personalized Digital Twins,ACL,2025,July,"Proceedings of the Fourth Workshop on Generation, Evaluation and Metrics (GEM²)","Experiment on Existing Models, Benchmark or Dataset","Used a large-scale psychometric dataset of more than 8,500 respondents from a previous study: ""Constructing
a psychometric testbed for fair natural language processing.""",USA,Bio-med,English,Closed Source,,"Each data points is a combination of survey-based measures, user-generated text, and demographic information, including responses on health numeracy, medical visit anxiety, and trust in healthcare providers.","8,500",Unclear,Treatment,"Text Generation, Regression, Classification",Analyzes how LLMs introduce bias in sexual and reproductive health responses,LLMs favored young adult females and specific geographic regions,"Disparate Impact (DI) scores, DI+, DI++ to measure intersectionality, AUC, F1, MSE, Pearson’s r",Deviation from demographic parity where disparate impact equals 1.,"white: No, black or african american: No, asian: No, native american or american indian: No native hawaiian or Pacific Islander: No, multiracial or biracial: No, other: No, age: No","Yes(white,black or african american,asian,native american or american indian,
native hawaiian or Pacific Islander, multiracial or biracial, other)",No,Yes (range 18-99),"Yes(female,male)","Yes(no_college,higher education, range of income <$20,000 to >$90,000)",No,No,No,"ChatGPT-4o,Llama-3-70b",System,No,Yes,Inference,"Using different prompting techniques, researchers recorded metrics like MSE, Pearson’s R, F1, AUC, and Disparity Index for different demographic cleavages like age, race, gender, income, and education."
AraTrust: An Evaluation of Trustworthiness for LLMs in Arabic,ACL,2025,January,Proceedings of the 31st International Conference on Computational Linguistics,"Experiment on Existing Models, Benchmark or Dataset",Human-written multiple‐choice benchmark (Arabic),Arabic-speaking region,Bio-med,Arabic,Couldn't Find,,"Each data point is a written multiple-choice questions spanning truthfulness, ethics, safety, health, unfairness etc. Researchers drew from authentic, human-generated sources, like colleague exams. We also used on existing datasets and online websites, like 18 samples from Arabic Hate Speech, a toxicity detection dataset curated from Twitter, and modified them to create questions assessing LLMs’ ability to detect offensive and toxic language, and they wrote 522 data points.",522,Unknown,Knowledge QA,Text Generation,"Researchers develop AraTrust and are looking to compare Arabic-centric LLMs and propriety LLMs trained primarily on other languages like English, a comprehensive benchmark to evaluate Arabic LLMs’ trustworthiness with multiple-choice questions. They focus on the following categories of trustworthiness: truthfulness, ethics, physical health, mental health, unfairness, illegal activities, privacy, and offensive language.",They found differences in trustworthiness and performance between the large proprietary models and the Arabic specific language model.,"Accuracy for different types of questions, which includes the categories truthfulness, ethics and morality, physical health, mental health, unfairness, illegal activities, privacy, offensive language",Differences in accuracy,"Arabic: Yes, Non-arabic: No",No,"Yes(Arabic, non-Arabic)",No,No,No,No,No,No,"ChatGPT-4,GPT-3.5-Turbo,AceGPT-7B,AceGPT-13B,Jais-13B",Human,No,No,Inference,"Researchers used zero-shot, one-shot, few-shot, zero-shot CoT prompting methods to evalute the trustworthiness of the LLMs. They did some preliminary, although less formal and not recorded, and they found that Arabic prompts generate more accurate responses than English prompts."
"AfriMed-QA: A Pan-African, Multi-Specialty, Medical Question-Answering Benchmark Dataset",ACL,2025,July,Proceedings of the 63rd Annual Meeting of the Association for Computational Linguistics (Volume 1: Long Papers),"Benchmark or Dataset, Experiment on Existing Models",New data source.,Africa (16 countries),Bio-med,English,Regulated,,"New data source. Medical trainees and clinicians
were recruited to contribute questions through referrals.",15000,,"Knowledge QA, Diagnosis",Text Generation,Evaluating LLM performance and bias in African medical contexts,Biomedical LLMs underperform; significant regional and specialty variation,"Accuracy, semantic similarity using
BERTScore, non-clinician ratings, clinician ratings",Differences in the aforementioned metrics,"African: Yes, Non-African: No",No,No,No,No,No,No,No,"Yes (African, Non-African)","30 LLMs, see paper","System, Human, Physician",No,No,None,None
Can AI Relate: Testing Large Language Model Response for Mental Health Support,ACL,2024,November,Findings of the Association for Computational Linguistics: EMNLP 2024,Experiment on Existing Models,"LLM responses to user posts in mental health forums (e.g., Reddit)",USA,Bio-med,English,Open Source,,Each data point is either a post or a peer response from Reddit. Framework measuring empathy and motivational interviewing adherence; human evaluators compared LLM vs peer support responses.,82942,Unclear,Other (Text Evaluation),"Classification, Regression","Examines empathy, equity, and quality of LLM responses in mental health support",LLMs showed lower empathy (2–13%) toward Black posters; disparities in emotional alignment,"Rate of agreement with human annotator, accuracy with attribute label, human rating of emotional reactions on 3 point Likert scale, human rating of interpretations on 3 point Likert scale, human rating of explorations on 3 point Likert scale, human rating of Cultivating Change Talk on 5 point Likert scale",Statistical significant of group differences in demographic parity.,"Asian: Yes, Black: Yes, Hispanic: No, White: No, Female: No, Male: No","Yes (asian, black, hispanic, white)",No,No,"Yes (female, male)",No,No,No,No,GPT-4 and similar frontier LLMs,"Human,Physician",Yes (non-clinician participants),Yes,"Train,Inference",Shows how generation methods affect empathy; suggests ethical and safety guidelines
Evaluating Biases in Context-Dependent Sexual and Reproductive Health Questions,ACL,2024,November,Findings of the Association for Computational Linguistics: EMNLP 2024,Experiment on Existing Models,"Sexual and reproductive health QA dataset with demographic context (age, sex, location)",USA,Bio-med,English,Open Source,,Curated from Planned Parenthood and public health QA sites; tested with and without demographic context,187,Unclear,Knowledge QA,Text Generation,Analyzes how LLMs introduce bias in sexual and reproductive health responses,LLMs favored young adult females and specific geographic regions,"Cosine similarity of embedding vectors, average similarity score meaning average cosine similarity scores across all relevant questions for each attribute’s group, percent win,  human evaluation and determine which groups is the model correctly responding.",Statistically significant differences in aforementioned metrics,"Female: Yes, Male: Yes, Younger: No, Older: Yes",No,No,"Yes (10, 15, 18, 21, 25, 30, 40, 50, 60, 70)","Yes (female, male)",No,No,No,"Yes (Hawaii, Idaho, Massachusetts, South Dakota, Vermont, Wyoming)","GPT-3.5, LLaMA-2, and similar models",Human,No,No,No,None
Open (Clinical) LLMs are Sensitive to Instruction Phrasings,ACL,2024,August,Proceedings of the 23rd Workshop on Biomedical Natural Language Processing,Experimental on Existing Models,"MIMIC-III,Obesity co-morbidity,Cohort Selection,Medical Challenge,Relations Challenge,Adverse Drug Effects,Risk Assessment","United States, Nigeria, Kenya, Canada, Zambia,
Egypt, Malawi, Pakistan, Philippines, and Ethiopia.",EHR,English,"Open Source, Needs a deeper dive",,"Data comes in the form of different classification tasks and information extraction tasks from various different databases. Then, medical professionals from different countries were recruited to write prompts to instruct existing models to try and answer these questions.",4353,Unclear,"Diagnosis,  Other (Mortality Prediction)","Classification, Extraction",Testing the ability of LLMs to answer medical challenges given natural variation in the wording of prompts written by actual medical professionals from different countries.,"Since many of the tasks or challenges are classification, the study uses F1 or AUROC as a metric.","AUROC, F1 score, Performance disparity across demographic subgroups, absolute differences in AUROC",Differences in aforementioned metrics,"Non-White: Yes, White: No, Female: Yes, Male: No","Yes(non white,white)",No,No,"Yes(female,male)",No,No,No,No,"Mistral (7b),Llama-2 (13b),Llama-2 (7b),Alpaca (7b),Clin-Camel (13b),Asclepius (7b),MedAlpaca (7b)",System,No,No,No,None
ChiMed-GPT: A Chinese Medical Large Language Model with Full Training Regime and Better Alignment to Human Preferences,ACL,2024,August,Proceedings of the 62nd Annual Meeting of the Association for Computational Linguistics (Volume 1: Long Papers),Experiment on New Models,"Chinese Medical Dataset (CMD), 
Data all mentioned here on hugging face: https://huggingface.co/datasets/shibing624/medical#:~:text=%E5%8E%9F%E5%A7%8B%E6%95%B0%E6%8D%AE%E9%9B%86%EF%BC%9A-,google%20drive,-%EF%BC%8C%E5%8F%AA%E5%AF%B9%E9%95%BF
Sublinks:
Freedom Intelligence: 
https://huggingface.co/datasets/FreedomIntelligence/huatuo_encyclopedia_qa
Chinese Medical book:
https://drive.google.com/u/0/uc?export=download&confirm=t&id=1ImYUSLk9JbgHXOemfvyiDiirluZHPeQw
Chinese medical dialogue data: 
https://github.com/Toyhom/Chinese-medical-dialogue-data
English dialogue data, “Chatdoctor”:
https://github.com/Kent0n-Li/ChatDoctor
Chinese dialogue data for reward part.
https://github.com/Toyhom/Chinese-medical-dialogue-data
Other part of Chinese dialogue data:
https://github.com/SCIR-HI/Huatuo-Llama-Med-Chinese",China,Bio-Med,"Chinese, English",Open Source,,"Mostly Chinese, but around a small portion of the data is in English. The data is broken up in to pretraining, fine-tuning, and reward data.",1643587,Unclear,"Knowledge QA, Information Dissemination","Text Generation, Extraction",Developing a new CHIMED-GPT model fine-tuned on medical data and testing it based on a metric designed to measure doctors' attitudes towards patients with mental disorders and diseases.,"They also evaluated the model in its performance in answering medical questions compared to other LLMs like ChatGPT, Ziya, Baichuan, Taiyi, and MedicalGPT. They test bias using the metric of the CAMI scale, which aims to measure public attitudes towards individuals suffering from mental disorders. They also use the MICA scale evaluates doctors’ attitudes towards patients with mental diseases through 16 statements.","Accuracy, BLEU, and ROUGE, F1 score, human-rated fluency on a scale of 1 to 3,
human-rated completeness on a scale of 1 to 3, human-rated precision on a scale of 1 to 3. ",Bias defined as how much the model expresses negative or stigmatizing attitudes towards a certain identity group on a numerical scale.,"Mental Disorders: No, Mental Diseases: No",No,No,No,No,No,No,"Yes(mental_disorders,mental_diseases)",No,"ChatGPT, Ziya, Baichuan, Taiyi, and MedicalGPT. ChiMed-GPT","System, Human",No,Yes,"Data,Train","For some models, researchers perform RLHF through rejection sampling following  Llama-2, with two steps: reward model training and rejection sampling fine-tuning."
Empirical Study of Social Bias in Medical Question Answering via Large Language Models,ACL,2025,August,Artificial Intelligence in Healthcare Conference Paper,"Experiment on Existing Models, Benchmark or Dataset","College Medicine, Medical Genetics, Professional Medicine datasets from the MMLU (Massive Multitask Language Understanding) datasets.",NA,Bio-Med,English,Open Source,,This dataset consists of multichoice questions covering many different branches of knowledge. Each data point is a multiple choice question.,545,Unclear,Knowledge QA,Text Generation,"Researchers prompted different LLMs with medical questions and demographic information about race, gender, and professional experience. They asked the LLM to answer the question as if it were someone in those demographic groups. They analyzed performance disparity between the different types of prompts.","Certain types of questions resulted in differences in performance between gender or racial groups. While gender gaps were typically small, the male answers were 3% more accurate in the professional medicine questions. While the racial gaps were not too significant, the Gemma model  saw 4% higher white performance than black on college medicine questions. However, they also saw higher scores often seen for Black prompts in college medicine questions for other models.",Accuracy,"This study quantifies bias as accuracy disparity between different demographics, holding all other variables constant and comparing performance across role information. More specifically, absolute percentage difference in accuracy.","Male: No, Female: Yes, Black: Yes, White: No","Yes(black, white)",No,No,"Yes (female, male)","Professional Bias (First Year, Second Year, Preclinical, Clinical)",No,No,No,"BioMistral-7B, Mistral-7B-v0.1, LLaMA-3.2-3B-Instruct, Gemma-3",System,No,No,None,None
Exposing and Mitigating Calibration Biases and Demographic Unfairness in MLLM Few-Shot In-Context Learning for Medical Image Classification,ACL,2025,September,Medical Image Computing and Computer Assisted Intervention – MICCAI 2025,"Experiment on Existing Models, Benchmark or Dataset","Researchers experimented on three medical imaging datasets: PAPILA for fundus image classification, HAM10000 for skin cancer classification, and MIMIC-CXR for chest X-ray classification.",NA,Bio-Med,NA,"Open Source, Regulated",,"364 were chosen from PAPILA, 1062 from HAM10000 and 1062 from MIMIC-CXR.",2488,,Diagnosis,Classification,"We introduce CALIN, an inference-time calibration method designed to mitigate the associated biases by estimating the amount of calibration needed.","We consider 5 different metrics in the experiments. (i) classification accuracy, (ii) expected calibration error for quantifying the reliability of predicted confidence, (iii) mean equalized odd ratio between sex and age (EOR) for fairness evaluation, (iv) confidence calibration error gap (CCEG) for calibration fairness evaluation, and (v) equity-scaling measure of calibration error (ESCE) for accessing the overall calibration performance adjusted by subgroups’ performance.","Expected Calibration Error (ECE), Confidence Calibration Error Gap (CCEG), Equalized Odds Ratio (EOR), Equity-Scaled Calibration Error (ESCE), accuracy,","Differences in aforementioned metrics, like Confidence Calibration Error Gap","Younger: Yes, Older: Yes, Male: No, Female: No",No,No,"Yes (younger, older)","Yes(female, male)",No,No,No,No,GPT-4o-mini,System,No,Yes,Inference,"CALIN operates through a bi-level calibration procedure, effectively mitigating unfairness. Experimental results on three medical imaging datasets demonstrate that CALIN not only enhances fairness but also improves overall predictive performance and exhibits minimum fairnessutility trade-off."
Elucidating Mechanisms of Demographic Bias in LLMs for Healthcare,DBLP,2025,November,Findings of the Association for Computational Linguistics: EMNLP 2025,Experiment on Existing Models,NA,NA,Generated,English,Regulated,,"Each data point is a single prompt paired with a clinical condition, run through an LLM 100 times to generate clinical vignettes yielding 1,000 vignettes per condition. For the depression risk task, each data point is one of 1,000 brief hospital courses from MIMIC-IV-Note, each passed through the model under four different prompt phrasings with and without activation patching to implicitly assign demographics. For the differential diagnosis task, researchers used a single NEJM Healer case and sampled 500 differential lists, comparing the rank of the correct diagnosis across demographic groups.",NA,10,Other (vignette generation),Text Generation,Researchers apply methods in mechanistic interpretability to healthcare LLMs.,They used activation patching and showed that they were able to affect the frequency at which patient vignettes of certain genders or races were generated.,"Representation of identities for certain diseases, Rank distribution of the correct diagnosis
for explicit and implicit gender assignment",Overrepresentation or underrepresentation of races for certain diseases,"Black: Yes, Asian: Yes, White: No, Hispanic: No, Female: Yes, Male: No,","Yes(Asian,Black,Hispanic,White)",No,No,"Yes(female,male)",No,No,No,No,"OLMo-7B-Instruct, Llama-3.1-8B-Instruct, Gemma-2-9B-it, and OLMo-2-0325-32B-Instruct",System,No,Yes,Training,Researchers applied activation patching at different layers and looked for differences in LLM-generated patient vignettes.
