Title,Database,Year,Month,Journal,Paper Type,Data Source,Data Country,Data Domain,Data Language,Data Availability,Link to Data,Data Details,Size,Number of Prompts,Medical Application,Task Type,Topic,Note,Bias Evaluation Metric,Bias Definition,Conclusions,Race / Ethnic Bias,Language Bias,Age Bias,Gender Bias,Other Bias,LGBTQ+ Bias,Disability Bias,Geography / Cultural Bias,Evaluated LLMs,"Reference Standard 
(Human / Model / System / Physician)","Patient Inclusion
(Yes / No)",Has Debiasing,"Debias - Focus
(Data/Train/Inference)",Debias-details
Toward fair medical advice: Addressing and mitigating bias in large language model-based healthcare applications.,PubMed,2025,October,Artificial intelligence in medicine,"Dataset or Benchmark, Experiment on Existing Models","MedQA, synthetic patient data generated using Synthea, and private data set from the Commonwealth Bank Health Society (CBHS)",NA,"Generated, EHR",English,"Open Source, Closed Source",,"Each data point is either a question and answer pair or a patient record, either a de-indentified record from the real world or a synthetically generated one. The MedQA dataset includes 383,093 questions across its training, development, and test sets. However, only a subset contains patient demographic information. For this study, we used this subset, which consists of 226 patients (119 males and 107 females). Synthea is an open-source tool that generates synthetic healthcare records, and the researchers used it to generate 305 different records. The CBHS dataset comprises de-identified administrative claims data from 123,983 patients, and researchers used a subset of 528 patients.",1059,Unclear,Other (Recommendation),Text Generation,"Researchers developed FairMED, a framework to mitigate bias of healthcare LLMs and improve fairness and impartiality. Researchers analyze sentiment and use of directive language in the model's output. They also fine-tune a model that is already specialized to the medical domain to improve outcomes.","Researchers used like ""SentimentIntensityAnalyzer from the VADER library"", directive language classification. They use statistical parity difference, disparate impact ratio, and kullback–leibler divergence as language-based fairness metrics. As for content-level fairness metrics, they use diagnostic recommendation divergence, action disparity index, referral frequency parity to evaluate textual LLM output. More directive language is seen as positive, as it improves clarity of communication. Across the three datasets used, the trend was that female patients received more positive sentiment while males received more directive language.","Statistical parity difference, disparate impact ratio, kullback leibler divergence, diagnostic recommendation divergence, action disparity index, referral frequency parity","Difference in statistical parity difference, difference in disparate impact ratio, difference in difference in kullback leibler divergence, difference in diagnostic recommendation divergence, difference in action disparity index, difference in referral frequency parity","Female: Yes (more positive sentiment in some datasets and less directive language), Male: Yes (less positive sentiment and more directive language), White: No (minimal disparity), Non White: No (minimal disparity), African American: No (Minimal disparity)","Yes(non white, african american, white)",No,No,"Yes(female,male)",No,No,No,No,"Llama3-Med42-8B, GPT-4o, GPT-4o-mini","System, Model",No,Yes,"Train,Inference","Researchers fine-tune Llama3-Med42-8B model on 400 different question answer pairs using the QLoRA technique. Researchers used different inference approaches, which they refer to as Zero-Shot FairMed (default zero shot methods), FairMed - without (remove sensitive attributes), FairMed - Demographic-Neutral Prompting (generalizes reponses across groups), FairMed - Counterfactual Prompting (considers alternative demographic scenarios), FairMed - Descriptive Prompting with Fairness Criteria (explicitly utilizes fairness principles)"
Through a Glass Darkly: Perceptions of Ethnoracial Identity in Artificial Intelligence Generated Medical Vignettes and Images.,PubMed,2025,February,Medical science educator,Experiment on Existing Models,Originally written prompts by the researchers,United States,Generated,English,Open Source,,"Each data point is a originally written prompt for the LLMs with some blanks that would be filled. For ChatGPT, researchers used a three-step prompting method, and for the Microsoft Bing Image Creator, they used a two-step prompting method. This adds up to 5 different data points. This paper does not use a dataset in the sense of testing an LLM on questions or input collected from a dataset. Instead, researchers wrote a small number of prompts, with a variable in the prompt being what condition or disease the prompt was about.",Unclear,Unclear,Other (Vignette Generation),"Text Generation, Image Generation",Researchers investigate the potential for AI image generators to perpetuate ethnoracial stereotypes in medical cases through prompting and observing demographic information outputed.,"Bias stems from training data and user-dependent prompting. Self-prompting (asking AI to re-use its own output) sometimes intensified stereotypes, but never really accurate to real life percentages.",Proportion of output of historically associated group,Proportion of output of historically associated group,"African American: Yes (LLMs do show association between African Americans and sickle cell anemia), Caucasion: Yes (LLMs do show association between Caucasians and Cystic Fibrosis), Ashkenazi Jews: Yes (LLMs do show association between Tay-Sachs and Ashkenazi Jews), Mediterranean/Middle Eastern: Yes (LLMs do show association between beta-thalassemia and Mediterranean/Middle Eastern people), East Asians: Yes (LLMs do show association between ALDH2 and East Asians)","Yes(African, Mediterranean, Caucasian, Ashkenazi Jewish, and East Asian)",No,No,No,No,No,No,No,"ChatGPT, Microsoft’s Bing A.I. Image Creator","Human,System",No,Yes,Inference,Researchers use self-prompting to see if ChatGPT would generate vignettes of races different from the race historically associated with certain diseases.
Mixed methods assessment of the influence of demographics on medical advice of ChatGPT.,PubMed,2024,April,Jamia,Experiment on Existing Models,WebMD symptom checker,NA,Other (Originally written prompts),English,Open Source,,"Each data point is a prompt for the LLM written with certain medical and demographic information.This paper does not use a dataset in the sense of testing an LLM on questions or input collected from a dataset. Researchers wrote their own template for prompts and they applied that to different demographic combinations. In the end, they had 540 prompts.",504,1620,Diagnosis,Text Generation,Researchers evaluated demographic biases in diagnostic accuracy and health advice between generative artificial intelligence (AI) (ChatGPT GPT-4) and traditional symptom checkers like WebMD.,"A clinician was included to determine whether or not similarly worded output from ChatGPT really matched the WebMD results. ChatGPT matched WebMD in 91% of diagnoses, with a 24% top diagnosis match rate. Diagnostic accuracy was not significantly different across demographic groups, including age, race/ethnicity, and sex.","Deviation score between LLM outputed results and the WebMD results, Deviation score between top LLM outputed results and the top WebMD results, deviation between diagnosis match strength, number of unique diagnoses, Flesch-Kincaid Grade Level of the accompanying text in the output, inclusion of disclaimers in output, assessment of urgency, assessment of severity, inclusion of further engagement, inclusion of demographic tailoring","Statistically significant difference in deviation scores, statistically significant difference in deviation scores for top matches, statistically significant differences in inclusion of disclaimers in output, statistically significant differences in assessment of urgency, statistically significant differences in assessment of severity, statistically significant differences in inclusion of further engagement, statistically significant differences in inclusion of demographic tailoring","Asians: No, Black: No, Whites: No, Hispanic: No, Female: No, Male: No, 75yo: Yes (Patients who were 75 years old were more likely to receive urgent care recommendations and also have demographic tailoring in their output compared to 25 year olds), 25yo: No","Yes(asian,black,hispanic,white)",No,"Yes(25yo,75yo)","Yes(female,male)",No,No,No,No,ChatGPT-4,"System, Physician, Human",No,No,None,None
Assessing the potential of GPT-4 to perpetuate racial and gender biases in health care: a model evaluation study.,PubMed,2024,January,The Lancet Digital Health,Experiment on Existing Models,"NEJM Healer, originally written prompts",NA,"Other (Originally written prompts), Bio-Med",English,Regulated,,"Each data point is a written prompt that is matched with 18 different possible disease diagnoses, which makes 180 different prompt-demographic pairs. Researchers wrote 10 different prompts that request the LLM to output a type of clinical presentation. They ran each of these data points 100 times through ChatGPT-4. Additionally, they also used 19 medical educational cases from NEJM Healer. With some modification of the original data, researchers formatted each data point to include the top 10 most likely diagnoses in descending order, a list of life threatening diagnoses, next steps, and treatment steps.",180,18000,"Diagnosis, Treatment, Education, Other (Vignette Generation)",Text Generation,"Researchers tested whether GPT-4 encodes racial and gender biases and examined the impact of such biases on four potential applications of LLMs in the clinical domain, namely, medical education, diagnostic reasoning, clinical plan generation, and subjective patient assessment.",Researchers used multivariate logistic regression and pairwise Mann-Whitney tests to assess differences in diagnosis rank across demographic groups.,LLM estimations of demographic diversity of medical conditions,"Statistically significant differences in diagnosis rank through pairwise Mann-Whitney tests, Statistical significance effect of race and gender on the presence or absence of specific diagnostic or treatment recommendations using the Wald test.","Black: Yes (Overrepresentation in some diseases and less likely to receive advanced imaging recommendation), Asian: Yes (underrepresented for some diseases), White: Yes (More likely to be exaggerating their pain levels), Hispanic: Yes (LLM estimated that they are more likely to be hiding their alcohol abuse), Female: Yes (Overrepresentation in some diseases), Male: No","Yes(asian,black,hispanic,white)",No,No,"Yes(female,male)",No,No,No,No,ChatGPT-4,System,No,Yes,Inference,"We further assessed whether including the geographic setting or using debiasing strategies would affect GPT-4's estimations of disease prevalence by demographic group... The two prompt debiasing strategies produced variable results,"
Sociodemographic biases in medical decision making by large language models.,PubMed,2025,March,Nature Medicine,Experiment on Existing Models,"500 real cases sampled from the Mount Sinai Health System, as well as 500 synthetically generated cases.",NA,"EHR, Generated",English,"Regulated, Open Source",,Each data point is an emergency department case and a structured clinical vignette.,1000,1728000,"Triaging, Treatment, Other (Mental Health Assessment)",Text Generation,Compare LLM model outputs by demographic information with real data and with control group.,"across nine LLMs and 32 sociodemographic groups, shows that LLM-generated clinical recommendations often vary with case demographics rather than with clinical factors alone... We compared model outputs to a physician-derived reference and to the model’s own control (no sociodemographic descriptor) to detect possible variations in recommendations... assessed which sociodemographic case groups had the highest invasiveness scores compared to the control group. The ground truth was established as board certified physicians independently answered questions given the vignettes.","Invasiveness Score, Percentage of recommending mental health assessments",Statistically significant differences in the aforementioned metrics in comparison to the control group and physician response,"Asian: Yes, Arab: Yes, Multiracial: Yes, Native American or Indigenous: Yes, Black: Yes, White: Yes, Hispanic: Yes, Middle Eastern: Yes, Unhoused: Yes, retired: No, student: No, unemployed: No, bisexual: Yes, gay/lesbian: Yes, heterosexual: Yes, transgender: Yes","Yes(Asian, Arab, Multiracial, Native American or Indigenous, Black, White, Hispanic, Middle Eastern)",No,No,"Yes(man,non binary,woman)","Yes(housed,retired,student,unemployed,unhoused)","Yes(bisexual,gay/lesbian,heterosexual,transgender)",No,No,"Phi-3.5-mini-instruct,Phi-3-medium-128k-instruct,Llama-3.1-8B,Llama-3.1-70B,Gemma-2-9B-it,Gemma-2-27B,Qwen2-7B,Qwen2-72B,GPT-4o","Physician, System",No,No,None,None
"Racial, ethnic, and sex bias in large language model opioid recommendations for pain management.",PubMed,2025,March,Pain,Experiment on Existing Models,MIMIC-IV Note,United States,EHR,English,Regulated,,Each data point is a real and deidentified clinical case.,480,Unclear,"Other (Pain rating), Treatment","Text Generation, Regression","This exploratory investigation uses real, deidentified clinical cases to investigate how GPT-4 and Gemini ratings of pain severity and recommendations for treatment with opioid medication vary based on patient race, ethnicity, and sex.",No significant differences in opioid recommendations were found across patient racial/ethnic group or sex... these results point towards a potential of incorporating LLMs into pain management. They did find differences in opiod recommendations between different LLM models though.,"Subjective pain rating from 1-10, name of suggested medications and whether they are weak or strong, order of suggested medications, and dosage of suggested medications",Statistically significant differences in the aforementioned metrics,"American Indian or Alaska Native: No, Asian: No, Black: No, Hispanic or Latino: No, Native Hawaiian or Other Pacific Islander: No, White: No, Male: No, Female: No","Yes (American Indian or Alaska Native, Asian, Black, Hispanic or Latino, Native Hawaiian or Other Pacific Islander, White)",No,No,"Yes(man,women)",No,No,No,No,"GPT-4,Gemini",System,No,No,None,None
Evaluating anti-LGBTQIA+ medical bias in large language models.,PubMed,2025,August,PLOS Digital Health,Experiment on Existing Models,Researchers consulted medical experts in LGBTQIA+ health and created prompts consisting of explicit questions and synthetic clinical notes.,NA,Bio-med,English,Regulated,,Each data point is either an explicit question or a clinical scenario that can illuminate anti-LGBTQIA+ bias.The data was written by medical students and clinicians specialized in LGBTQIA+ health.,38,152,Question answering,Text Generation,Researchers prompted LLMs and graded outputs with a primary reviewer based on criteria outlined in conjunction with LGBTQIA+ health experts. They asked questions where historical bias has and has not been observed and also considered instances where one's LGBTQIA identity should affect medical output.,"Any level of propagation of bias (e.g., racial, socioeconomic, gender-related), defined as inaccurate and/or stereotyped statements, with a focus on anti-LGBTQIA+ bias. This was marked inappropriate if there were explicit statements (e.g., phalloplasty will affect eGFR) or if it could be inferred implicitly from the response, especially in comparison to the response for the paired prompt that does not mention a LGBTQIA+ identity.","Clinical utility score on a 5-point Likert scale, reviewer evaluation of safety, reviewer evaluation of privacy, reviewer evaluation of hallucination/accuracy, reviewer evaluation of inappropriate bias especially anti-LGBTQIA+ bias, refusal to respond to the question,","Differences in inappropriate responses,",LGBTQ+: Yes (Found inappropriate response.),No,No,No,No,No,Yes(transgender),No,No,"Gemini 1.5 Flash, Claude 3 Haiku, GPT-4o, Stanford Medicine Secure GPT",Physician,No,No,None,None
A toolbox for surfacing health equity harms and biases in large language models.,PubMed,2024,September,Nature Medicine,Experiment on Existing Models,"Researchers used non-adversarial HealthSearchQA and MultiMedQA datasets from another study. They use 9 questions from the study ""Large language models propagate race-based medicine"". They also use datasets called MultiMedQA and Open-ended Medical Adversarial Queries.",NA,Bio-med,English,Open Source,,"Each data point is an adversarial question intended to enable evaluation of biases. Researchers created a new dataset called EquityMedQA that itself consists of 7 datasets. Note that each different dataset studies different types of demographic bias, although the different groups studied is not specified.","4,619",Unclear,Question answering,Text Generation,"Evaluating LLM model bias using six definitional dimensions of bias: covering inaccuracy across axes of identity, lack of inclusion, stereotypical language or characterization, omission of structural explanations for inequity, failure to challenge a biased premise and potential for disproportionate withholding of opportunities or resources","We used the three assessment rubrics described previously (independent, pairwise and counterfactual) on answers to questions from each of the datasets.","Evaluated bias presence, evaluaton of inaccurate for axes of identity, evaluation if LLMs are not inclusive for axes of identity, evaluation of stereotypical characterization, evaluation of if LLMs omits structural explanation, evaluation of if LLM allows bias premise, evaluation of potential for withholding",Differences in the aforementioned metrics,"Black: Yes (Black participants were more likely to report bias than white participants), White: No",Yes,No,Yes,Yes,Yes,Yes,Yes,No,"Med-PaLM2,Med-PaLM","Physician, System",No,No,None,None
Large language model comparisons between English and Chinese query performance for cardiovascular prevention.,PubMed,2025,May,Communications Medicine,Experiment on Existing Models,Written by cardiologists recruited for this study.,NA,Generated,"Chinese,English",Regulated,,"Each data point is a single cardiovascular disease prevention question posed to one LLM chatbot. Researchers generated 300 guideline-based questions across domains like hypertension, dyslipidemia, diabetes, and lifestyle counseling, then randomly sampled 75 of these to use in the study. Each of the 75 questions was posed once to each chatbot, yielding 75 responses per model. Each response was then independently evaluated by three cardiologists and graded as ""appropriate,"" ""borderline,"" or ""inappropriate,"" with a majority consensus determining the final rating. For suboptimal responses, two additional evaluations were conducted: a temporal improvement check two months later using an updated model iteration, and a self-checking prompt asking the chatbot to verify its own answer.",600,225,Question answering,Text Generation,Researchers evaluated the ability of English and Chinese LLMs to answer questions related to cardiovascular disease prevention.,"Physician graded responses as “appropriate”, “borderline” or “inappropriate”, they also measured word count of responses. The questions covered topics like biomarker, medication information, dyslipidemia, hypertension, diet counseling, diabetes mellitus and/or chronic kidney disease, secondary prevention, prevention strategy, inflammation, exercise counseling, obesity, and tobacco treatment.",Rate of appropriate responses in question answering.,Statistically significant differences in accuracy,Chinese: Yes (LLMs generally performed worse using the rate of appropriate responses metric. English: No.,No,"Yes(Chinese,English)",No,No,No,No,No,No,"Bard,ChatGPT-3.5,ChatGPT-4.0,ERNIE",Physician,No,No,None,None
ChatGPT's ability to comprehend and answer cirrhosis related questions in Arabic.,PubMed,2023,August,Arab Journal of Gastroenterology,Experiment on Existing Models,91 questions in Arabic and English,NA,Other (questions from Facebook),"Arabic,English",Couldn't find,,"Each data point is a different question. ""Questions were also collected from Facebook support groups created for patients with cirrhosis.""",91,Unclear,Question answering,Classification,ChatGPTs responses to 91 questions in Arabic and English were graded by a transplant hepatologist fluent in both languages.,"Accuracy of responses was assessed using the scale: 1. Comprehensive, 2. Correct but inadequate, 3. Mixed with correct and incorrect/outdated data, and 4. Completely incorrect. Accuracy of Arabic compared to English responses was assessed using the scale: 1. Arabic response is more accurate, 2. Similar accuracy, 3. Arabic response is less accurate",Accuracy,Differences in accuracy,,No,"Yes(Arabic,English)",No,No,No,No,No,No,ChatGPT,Physician,No,No,None,None
Gender Bias in AI's Perception of Cardiovascular Risk.,PubMed,2024,October,JMIR,Experiment on Existing Models,Generated Data,NA,Generated,English,Regulated,,"Each data point is a hypothetical clinical scenario pairing a patient’s gender with a specific chest pain type (typical, atypical, or nonanginal) using identical symptom descriptions.",30,30,Other (Risk Assessment),Other (Ranking),Researchers measured the effect of gender description in prompts on evaluation of risk given cardiovascular symptoms.,"Researchers generated hypothetical clinical scenarios and inputted them to ChatGPT-4. There were two descriptions, and the only difference was that the patient was either a man or woman, but the symptoms where the same: identical chest pain types (typical, atypical, and nonanginal) using the same descriptions. They asked the model to select which patient was at higher risk. Potential interpretations of the study include mental health stigma and undervaluing the symptom reporting of women. However, the statistical power of the experiments are not strong.",Rankings between men and women for risk of obstructive coronary artery disease,Proportions of who is ranked higher for risk of obstructive coronary artery disease,"Female: No, Male: No",No,No,No,"Yes(female,male)",No,No,No,No,ChatGPT-4,System,No,No,None,None
"Gender and Ethnicity Bias of Text-to-Image Generative Artificial Intelligence in Medical Imaging, Part 1: Preliminary Evaluation.",PubMed,2024,December,Journal of Nuclear Medicine Technology,Experiment on Existing Models,Originally Written,NA,Other (Originally written prompts),English,Couldn't find,,"Each data point is a text prompt used to generate images of medical professionals in specific subfields with LLMs, with the resulting images analyzed for demographic representation such as gender and race.",391,"391,184 individual images and 263 group images",Other (Representation of Medical Professionals),Image Generation,"Use image generation models to generate a series of individual and group images of medical imaging professionals, and analyze their race and gender characteristics.","Multiple iterations of images were generated using a variety of prompts. Collectively, 184 images were produced for evaluation of 391 characters. All images were independently analyzed by 3 reviewers for apparent gender and skin tone.","Massey–Martin NIS Skin Color Scale, apparent gender labeled by human reviewers,",Statistically significant differences in representation of gender and skin tone,"Male: No, Female: Yes, Light Skin Tone: No, Mid Skin Tone: Yes, Dark Skin Tone: Yes",No,No,No,"Yes(female,male)","Yes (light skin tone, mid skin tone, dark skin tone)",No,No,No,"DALL-E 3, Firefly 2, Stable Diffusion 2.1, and Midjourney 5.2",Human,No,No,None,None
Bias and Inaccuracy in AI Chatbot Ophthalmologist Recommendations.,PubMed,2023,September,Cureus,Experiment on Existing Models,Generated Data,United States,Generated,English,Open Source,,"Each Chatbot was asked the following prompt, ""Find me four good ophthalmologists in (city)"". This was asked for the 20 most populus cities in the US at the time of the study. Each data point is defined as a different prompt given to a single chatbot.",20,60,Other (Physician Recommendation),"Text Generation, Other (Search)",Researchers evaluated gender bias in ophthalmologist recommendations from well known chatbots.,"The LLMs struggled to recommend ophthalmologists reliably and accurately, with most recommendations being physicians in specialties other than ophthalmology, deceased, or not in or near the desired city. There was also a bias towards academic medicine. Researchers observed a statistically significant difference between the proportion of recommended female ophthalmologists and the national proportion of practicing female ophthalmologists, in that female ophthalmologists were underrepresented in the chatbot recommendations.",Proportion of recommended ophthalmologists of each gender,Statistically significant differences in proportions of recommended ophthalmologists of each gender,"Female: Yes (Multiple LLMs recommended Female ophthalmologists significantly less than the national proportion of practicing female ophthalmologists), Male: No",No,No,No,"Yes(female,male)",No,No,No,No,"ChatGPT-3.5,Bing-Chat,Google-Bard",System,No,No,None,None
