Title,Database,Year,Month,Journal,Paper Type,Data Source,Data Country,Data Domain,Data Language,Data Availability,Link to Data,Data Details,Size,Number of Prompts,Medical Application,Task Type,Topic,Note,Bias Evaluation Metric,Bias Definition,Conclusions,Race / Ethnic Bias,Language Bias,Age Bias,Gender Bias,Other Bias,LGBTQ+ Bias,Disability Bias,Geography / Cultural Bias,Evaluated LLMs,"Reference Standard 
(Human / Model / System / Physician)","Patient Inclusion
(Yes / No)",Has Debiasing,"Debias - Focus
(Data/Train/Inference)",Debias-details
Assessing Biases in Medical Decisions via Clinician and AI Chatbot Responses to Patient Vignettes.,PubMed,2023,October,JAMA Network Open,Experiment on Existing Models,"The data is pulled from 8 other existing papers.
1. Green AR, Carney DR, Pallin DJ, et al. Implicit Bias among Physicians and its Prediction of Thrombolysis Decisions for Black and White
Patients. J Gen Intern Med. 2007;22(9):1231. doi:10.1007/S11606-007-0258-5
2. Breathett K, Yee E, Pool N, et al. Association of Gender and Race With Allocation of Advanced Heart Failure Therapies + Editorial +
Supplemental content. JAMA Netw Open. 2020;3(7):2011044. doi:10.1001/jamanetworkopen.2020.11044
3. Daugherty SL, Blair I V., Havranek EP, et al. Implicit gender bias and the use of cardiovascular tests among cardiologists. J Am Heart Assoc.
2017;6(12). doi:10.1161/JAHA.117.006872
4. Lutfey KE, Link CL, Marceau LD, et al. Diagnostic certainty as a source of medical practice variation in coronary heart disease: Results from
a cross-national experiment of clinical decision making. Med Decis Making. 2009;29(5):606. doi:10.1177/0272989X09331811
5. Centola D, Guilbeault D, Sarkar U, Khoong E, Zhang J. The reduction of race and gender bias in clinical treatment recommendations using
clinician peer networks in an experimental setting. Nat Commun 2021 121. 2021;12(1):1-10. doi:10.1038/s41467-021-26905-5
6. Haider AH, Sexton J, Sriram N, et al. Association of unconscious race and social class bias with vignette-based clinical assessments by
medical students. JAMA. 2011;306(9):942-951. doi:10.1001/JAMA.2011.1248
7. Simard JF, Chaichian Y, Rizk N, Rector A, Feldman CH, Falasinnu TO. ARE WE MISSING LUPUS IN MALES? EVIDENCE OF COGNITIVE
BIAS FROM A RANDOMIZED EXPERIMENT IN THE UNITED STATES. Am J Epidemiol. 2022;191(1):230. doi:10.1093/AJE/KWAB199
8. Zadu A, van Egmond S, de Vere Hunt I, Petion E, Cai Z, Yeung H, Simard J, Linos E. Prescribing Patterns for Acne in
 Transgender Compared to Cisgender Patients. Poster presented at American Academy of Dermatology 2023 Annual Meeting.
 March 17th, 2023; New Orleans, LA, USA.",NA,Bio-med,English,Regulated,,"Each data point is a clinical vignette selected from existing literature across medical disciplines such as cardiology, emergency medicine, rheumatology, and dermatology.",19,38,"Diagnosis, Treatment, Other (Risk Assessment)",Classification,Researchers evaluated the bias of LLM responses across many different demographic factors in different medical subfields.,"Different LLM prompts had different outputs, with some on the Likert scale and others being yes or no. Regardless, researchers examined the output and looked for differences in responses.","Likelihood of disease, diagonsis rates, treatment recommendations","Statstically significant differences in estimation of likelihood of disease, diagonsis rates, treatment recommendations",,"Yes(black,hispanic,white)",No,No,"Yes(female,male)",Yes,"Yes(transgender_man,transgender_woman)",No,No,"ChatGPT-4,Bard",Physician,No,No,None,None
AI-driven translations for kidney transplant equity in Hispanic populations.,PubMed,2024,April,Nature,Experiment on Existing Models,"Frequently asked questions from Organ Procurement and Transplantation Network (OPTN), National Health Service (NHS), and National Kidney Foundation (NKF).",NA,Bio-med,English,Open Source,,"Each data point is a frequently asked question about kidney transplantation collected from public health sources such as OPTN, NHS, and the National Kidney Foundation.",54,Unclear,Other (Translation),Other (Translation),Researchers assess the accuracy of frequently asked questions on kidney health both in linguistic accuracy and cultural sensitivity.,"The models' translations where assessed by Mexican native Spanish speaking nephrologists using a rubric with values from 1 to 5. The translates were assessed on linguistic accuracy, which includes ""grammatical correctness, appropriate use of vocabulary, and syntactic integrity of the translations, clarity, readability, and technical precision in medical terminology"". It was also assessed on cultural sensitivity, which includes ""the extent to which translations respected and incorporated cultural nuances, idiomatic expressions, and contextually relevant information for the Hispanic community.""","Linguistic accuracy on a Likert scale, cultural sensitivity on a Likert scale","Statistically significant differences in linguistic accuracy on a Likert scale, statistically significant differences in cultural sensitivity on a Likert scale",Spanish: No,No,Yes(spanish),No,No,No,No,No,No,"ChatGPT-3.5,ChatGPT-4.0",Physician,No,No,None,None
Physician clinical decision modification and bias assessment in a randomized controlled trial of AI assistance.,PubMed,2025,March,Nature,Experiment on Existing Models,"There are 2 videos of a standard patient actor depicting a case of chest pain in an outpatient setting, with the actor being either a white male or a black female. 50 physicians are invited to view these videos.",NA,Bio-med,None,Open Source,,"Each data point is a physician or resident physicians with training in a general medical specialty (internal medicine, family medicine, or emergency medicine) viewing one of two videos.",50,Unclear,"Other (Clinician Assistance, Risk Assessment), Triage, Treatment",Text Generation,Researchers studied how AI assistance affect physician accuracy or bias.,"Summary from the paper: ""We investigated how doctors respond to AI suggestions when evaluating chest pain, a common but serious medical concern. We showed 50 doctors a video of either a white male or Black female patient describing chest pain symptoms, and asked them to make medical decisions. The doctors then received suggestions from an AI system and could change their decisions. We found that doctors were willing to consider the AI’s suggestions and made more accurate medical decisions after receiving this help. This improvement in decision-making happened equally for all patients, regardless of their race or gender, suggesting AI tools could help improve medical care without increasing bias.""",Accuracy of questions,Statistically significant differences in accuracy of questions,"Black: No, White: Yes (Researchers found that participants were more accurate when viewing the Black female video vs. the white male video (p < 0.01) (Supplementary Table 6). The reason for the differing results is unclear but could perhaps be attributed to the Hawthorne effect),","Yes(black,white)",No,No,"Yes(female,male)",No,No,No,No,ChatGPT-4,system,No,No,None,None
Ensuring Accuracy and Equity in Vaccination Information From ChatGPT and CDC: Mixed-Methods Cross-Language Evaluation.,PubMed,2024,October,JMIR,Experiment on Existing Models,CDC website in both English and Spanish,United States,Bio-Med,"English,Spanish",Outdated,,"Each datapoint is a frequently asked vaccination-related question on the CDC website, either in English or Spanish. There are 16 questions in each language.",32,128,Information Dissemination,Text Generation,"Researchers measured accuracy, understandability, and readability of ChatGPT's responses to frequently asked vaccination-related questions on the CDC website","There were human readers who assessed the misinformation levels and readability, but also objective system-based metrics for readability, like the Flesch-Kincaid grade level score.","Sentence count, syllable count, understandability, grade level, Flesch-Kincaid readability scores for English and Flesch-Huerta index for Spanish",Differences in the aforementioned metrics,"English: No, Spanish: No",No,"Yes(English,Spanish)",No,No,No,No,No,No,ChatGPT,"Human,System",Yes,No,None,None
Exploring Biases of Large Language Models in the Field of Mental Health: Comparative Questionnaire Study of the Effect of Gender and Sexual Orientation in Anorexia Nervosa and Bulimia Nervosa Case Vignettes.,PubMed,2025,March,JMIR Mental Health,Experiment on Existing Models,12 different scientific papers from PubMed and Google Scholar.,NA,Bio-Med,English,Open Source,,"Each data point is a clinical vignette describing a patient with anorexia nervosa or bulimia nervosa, with variations in gender and sexual orientation used as prompts for LLM evaluation.",120,720,Other (evaluating the severity of symptoms),Regression,Researchers prompted ChatGPT-4 and MentaLLaMAto score measures of mental health-related quality of life given prompts with different gender and sexual orientations.,"ChatGPT-4 showed a gender bias. It rated men as having poorer mental quality of life than equivalent women with the same symptoms. No bias was found for sexual orientation. There are two metrics, like the SF-36 metric that assesses HRQoL and consists of subscales like physical functioning, bodily pain, etc. Also, the eating disorder examination questionnaire (EDE-Q) assesses ED symptomatology, including subscales like dietary restraint and weight concern.",Regression analysis,Statistically significant features in regression analysis,"Female: No, Male: Yes, Heterosexual: No, Homosexual: No",No,No,No,"Yes(female,male)",No,"Yes(heterosexual,homosexual)",No,No,"ChatGPT-4,MentaLLaMA",System,No,No,None,None
Evaluating for Evidence of Sociodemographic Bias in Conversational AI for Mental Health Support.,PubMed,2025,January,"Cyberpsychology, Behavior, and Social Networking",Experiment on Existing Models,Generated Prompts,NA,Generated,English,NA,,"Each data point is a conversation scenario defined by a specific demographic combination, used to prompt ChatGPT-3.5 to simulate a patient complaint and interaction with a conversational agent.",97,444,Other (physician–patient conversations simulation),Text Generation,"In this study, we present an approach to investigate the presence of bias within an LLM designed for mental health support.","We simulated physician–patient conversations by using a communication loop between an LLM-based conversational agent and digital standardized patients (DSPs) that engaged the agent in dialogue while remaining agnostic to sociodemographic characteristics. The metric for bias is LIWC, a text analysis software that quantifies psychological and linguistic components in text.","Linguistic Inquiry and Word Count (LIWC-22) tool, mean positive tone, mean negative tone",Statistically significant features in multivariable linear regression for linguistic inquiry and word count (LIWC-22) tool.,"Hispanic: No,non hispanic black: No, Non hispanic white: No, Age 40: No, Age 80: No, female: No, male: No, Transgender Female: No, Transgender Male: No, 25000 salary: No, 50000 salary: No, 500,000 salary: No, 1000000 salary: No","Yes (hispanic,non hispanic black,non hispanic white)",No,"Yes(40yo,80yo)","Yes(female,male,transgender_female,transgender_male)","Yes(25000_salary,50000_salary,500,000_salary,1000000_salary)",No,No,No,LLM-based program previously developed and tested at Cedars-Sinai Medical Center,System,No,No,None,None
Fairness in AI-Driven Oncology: Investigating Racial and Gender Biases in Large Language Models.,PubMed,2024,September,Cureus,Experiment on Existing Models,Generated Prompts,None,Generated,English,Open Source,,"Each data point is a prompt describing a healthcare professional in oncology with specific racial and gender demographics, used to evaluate LLM responses about professional roles and recommendations.",4,Prompted 10 times for each demographic,Other (oncologist recommendations),Text Generation,Researchers prompted LLMs with questions related to the roles of oncology professionals based on demographic data.,"They compared the outputs of the LLMs to actual healthcare statistics on the demographics of healthcare professionals as well as patient demographics for certain diseases, for the other questions related to certain diseases.",Proportion of recommended ophthalmologists of each identity,Statistically significant difference in proportion of recommended ophthalmologists from national statistics,"Black: Yes (less representation in recommendations), Hispanic: Yes, Native American: Yes, White: Yes, Asian: Yes (less likely to be a part of advocacy and community outreach), Female: Yes, Male: Yes","Yes(asian,black,hispanic,native american,white)",No,No,"Yes (female, male)",No,No,No,No,"ChatGPT,Gemini,BingChat",System,No,No,None,None
Mitigating the risk of health inequity exacerbated by large language models.,PubMed,2025,May,npj Digital Medicine,Experimental on Existing Models,"They used five datasets. SIGIR 2016 (Proceedings of the 39th International ACM SIGIR conference on Research and Development in Information Retrieval), TREC 2011, and TREC 2022 (Clinical Trial datasets), while the medical question answering, or MQA, datasets are MedQA8 and MedMCQA",None,Bio-med,English,"Open Source, Regulated",,Each data point is a patient clinical note or medical query augmented with non-decisive socio-demographic factors,,Unclear,"Knowledge QA, Other (Clinical trial matching)",Text Generation,"Researchers examined how including socio-demographic factors leads LLMs to biased/mistaken outputs, and proposes mitigation.",Used metric called Normalized Discounted Cumulative Gain at rank 10. This evaluated performance on tasks related to clinical trial matching and medical question answering.,"Normalized Discounted Cumulative Gain, equal opportunity (EO) and demographic parity (DP)","Differences in aforementioned metrics, researchers evaluated whether certain race, sex and SDOH factors were correlated with similar biased outcomes","Black: No, Native American: Yes, Middle Eastern: Yes, Pacific Islander: Yes, Homelessness: Yes, unemployment: Yes, Low income: Yes
asian: No, hispanic: No, LGBTQ+: No, Female: No, Male: No","Yes(african american,asian,black,east asian,hispanic,indigenous,middle eastern,native american,mixed race,pacfic islander,south asian,white)",No,No,"Yes(female, male)","Yes(homeless,unemployed,low_income)",Yes(LGBT+),No,No,"GPT-4,GPT-4o-mini, Gemini-1.5-Flash, Claude-3-5-sonnet-20240620",System,No,No,None,None
Invisible Bias in GPT-4o-mini: Detecting Disparities in AI-Generated Patient Messaging.,PubMed,2025,NA,Journal of Medical Systems,Experiment on Existing Models,Generated,None,Generated,English,Couldn't Find,,Data generated by ChatGPT-4o-mini,Unclear,10000,Education,Text Generation,"Researchers used an LLM to score LLM-generated patient conversations on empathy, encouragement, accuracy, clarity, professionalism, and respect.","The study also studies demographic divisions along the lines of housing status, including categories like homeless, living alone, living with family, living in a care facility, or living in a shelter. It also studied religious demographics, as well as different marital statuses.","Empathy score, encouragement score, accuracy score, clarity score, professionalism score, respect score",Statistically significant differences in the aforementioned metrics,"Female: Yes (More empathy and encouragement), black: No, east asian: No,hispanic or latino: No,middle eastern: No,south asian: No,white: No, homeless: no,","Yes(black,east asian,hispanic or latino,middle eastern,other,south asian,white)",No,Yes(35yo-75yo),"Yes(female,male)","Housing (homeless, ‘Living home alone’, ‘Living at home with family’, ‘Care Facility’, ‘Shelter’, and ‘Other’), Religious (‘Christian’, ‘Catholic’, ‘Jewish’, ‘Islamic’, ‘Buddhist’, ‘Hindu’, ‘None or No Preference’, and ‘Other’), Marital Status (‘Married’, ‘Single’, ‘Separated’, ‘Divorced’, and
‘Other’)",No,No,No,ChatGPT-4o-mini,Model,No,No,None,None
Benchmarking bias in embeddings of healthcare AI models: using SD-WEAT for detection and measurement across sensitive populations.,PubMed,2025,July,BMC Medical Informatics and Decision Making,"Experiment on Existing Models, Benchmark / Dataset",Other studies,None,Bio-med,English,"Unclear, will need help",None,"Referred to in the study as G-1,G-2,G-3,G-4",Unclear,Unclear,Other (Bias Evaluation),Other (Output vector embeddings),Researchers studied ways to measure bias in LLMs using word embeddings methods.,"They examined hereditary conditions on small populations known to have certain diseases, namely Finnish and Ashkenazi Jewish.",SD-WEAT bias scores,bias is measured between these pairs of target and attribute sets with the default WEAT effect size and P value formula,"Black: No, Hispanic: No, White: No, Female: No, Male: No","Yes(black,hispanic,white)",No,No,"Yes(female,male)",No,No,No,No,"GloVe,BERT,LegalBERT,BioBERT,GPT-2,BioGPT",System,No,No,None,None
Assessing Racial and Ethnic Bias in Text Generation by Large Language Models for Health Care-Related Tasks: Cross-Sectional Study.,PubMed,2025,March,JMIR,Experiment on Existing Models,Used structured hospital encounter metadata in a table format from 100 randomly selected fully deidentified encounters for patients with HIV.,None,Bio-med,English,Regulated,,"Each data point is includes the patient’s demographics, primary encounter diagnosis, and HIV disease control status at the time of the encounters.",100,1600,Other (Discharge Instructions),Text Generation,"Researchers prompted LLMs to write discharge instructions for patients with HIV and analyzed the responses for sentiment, subjectivity, reading ease, and word frequency by race/ethnicity given in the prompt.",,"Polarity scores, subjectivity scores, readability scores, readability grade levels, and text length","Researchers used the Shapiro-Wilk test to check the data in each group for normality and used accordingly 1-way ANOVA or Kruskal-Wallis test to test for differences among groups. For categorical variables like NER counts and word frequency distributions, researchers used chi-square tests to compare observed frequencies across different races/ethnicities. When the omnibus chi-square test was significant, researchers performed post hoc pairwise chi-square comparisons with Bonferroni correction to identify specific group differences.","African American: No, hispanic: No, White: No, Asian: No","Yes(african american,asian,hispanic white,non hispanic white",No,No,No,No,No,No,No,"ChatGPT-3.5-turbo,ChatGPT-4,Gemini-1.0-pro,Llama3-70b",System,No,No,None,None
Potential to perpetuate social biases in health care by Chinese large language models: a model evaluation study.,PubMed,2025,July,International Journal for Equity in Health,Experiment on Existing Models,"Used 19 clinical cases proposed by the New England Journal of
Medicine (NEJM) Healer, which helped create 32 prompts for each
clinical vignette, representing varied combinations of the
patient sociodemographic characteristics. Also used 8 clinical vignettes 
developed by another researcher for patients' needs assessment. 
They made 32 prompts from that too. They also generated some 
synthetic data from the LMs for 3 select diseases.",None,"Bio-med, Generated",English,"Unclear, will need help",,Each datapoint is a clinical vignette from NEJM healer.,27,98400,"Diagnosis, Treatment, Other (Clinical Case generation, assess patient needs)",Text Generation,"Researchers tested how much Chinese LLMs perpetuated bias in patient need assessment, differential diagnosis and treatment planning.","Researchers tested 3 different applications: clinical cases for medical education, differential diagnosis and treatment, and patient needs assessment.","Average ranking of the top expert-preferred primary diagnosis, The percentage of inclusion of the top expert-preferred primary diagnosis, The average ranking of each expert-preferred diagnosis",Differences in the aforementioned metrics between identity groups leading to overrepresentation or underrepresentation,"Minority: Yes, Han: Yes, Female: Yes, Male: Yes,  No Insurance: Yes, Have Insurance: Yes, Low Education: Yes, High Education: No, Low Income: Yes, High Income: Yes",Yes(han/minority),No,No,"Yes(female,male)","Yes (low_education,high_education,low_income,high_income,no_health_insurance,have_health_insurance)",No,No,No,"Qwen-turbo,Erine-lite-8k,Baichuan2-turbo",System,No,No,None,None
Evaluating the Performance and Bias of Natural Language Processing Tools in Labeling Chest Radiograph Reports.,PubMed,2024,October,Radiology,Experiment on Existing Models,"This study uses chest radiograph (CXR) report from an Indiana University dataset and chest radiograph reports from the Medical Information Mart for Intensive Care, or MIMIC. 
(MIMIC) dataset.",USA,Bio-Med,English,Regulated,"https://www.kaggle.com/datasets/raddar/chest-xrays-indiana-university,","Each data point is a chest radiograph, with 3665 from the Indiana University Dataset and 692 from the MIMIC dataset. Evaluation of NLP tools for labeling radiograph reports & bias assessment",4357,Unclear,Other (Radiology Report Labeling),Classification,Researchers compared the labeling of chest radiograph reports of LLMs and other NLP models compared to radiologists.,Labels include 14 different diseases.,"accuracy, positive predictive value (PPV), negative predictive value (NPV), sensitivity, specificity, F1 score","Bias was evaluated by comparing the proportion of errors, accuracy, PPV, NPV, sensitivity, and specificity for each NLP tool, stratified according to demographic variable.","American indian/native american: No, Asian: No, Black: No,Hispanic or latino: No, White: No, Medicaid Insurance: No, Medicare Insurance: No, other insurance: No, Age <20: No, Age 20-40: No, Age 40-60: No, Age 60-80: Yes, Age >80: Yes, Female: No, Male: No","Yes(american indian/native american,asian,black,hispanic or latino,white)",No,"Yes(<20,20-40,40-60,60-80,>80)","Yes(female,male)","Yes(medicaid_insurance,medicare_insurance,other_insurance)",No,No,No,"ChexPert,RadReportAnnotator,cTakes,ChatGPT-4",Physician,No,No,None,None
"Identifying social determinants of health from clinical narratives: A study of performance, documentation ratio, and potential bias.",PubMed,2024,May,Journal of Biomedical Informatics,Experiment on Existing Models,UF Health Integrated Data Repository,USA,"Bio-Med, EHR",English,Couldn't Find,,"This study used clinical narratives from UF Health Integrated Data Repository (IDR). The UF Health IDR is a clinical data warehouse that aggregates data from the university’s various clinical and administrative information systems, including the Epic (Epic Systems Corporation) system.","20,000",Unclear,Other (Information Retrieval),Classification,"Compared seven transformer-based large language models (including BERT, RoBERTa, DeBERTa, Longformer, and GatorTron) for extracting SDoH concepts and linking their attributes.",Researchers developed an SDoH corpus.,"F1 score, precision, recall, extraction ratio",Differences in the aforementioned metrics,"Black: Yes, Other: Yes, White: No, Female: No, Male: No","Yes(black,other,white)",No,No,"Yes(female,male)",No,No,No,No,None,System,No,Yes,"Data,Train","The cancer SDoH corpus was used to train, validate, and test transformer-based models: BERT, RoBERTa, GatorTron, DeBERTa, Longformer"
How Can We Diagnose and Treat Bias in Large Language Models for Clinical Decision-Making?,ACL,2025,April,Proceedings of the 2025 Conference of the Nations of the Americas Chapter of the Association for Computational Linguistics: Human Language Technologies (Volume 1: Long Papers),Experiment on Existing Models,"JAMA Clinical Challenge, two dataset: JAMA_Chen2024 dataset and JAMA_CPV dataset",None,Bio-Med,English,Open Source,https://github.com/kenza-ily/diagnose_treat_bias_llm,"Each data point comprises a detailed patient description (250 words), a specific clinical question, four answer options, the correct answer index, a discussion (500-600 words) elaborating on the preferred option, and a medical speciality classification. Each data point is a challenge question with description for the LLMs.",3256,Unclear,Knowledge QA,Text Generation,Alternate dataset and evaluation techniques for debiasing.,"“We introduce a novel Counterfactual Patient Variations (CPV) dataset derived from the JAMA Clinical Challenge... By combining accuracy comparisons, statistical methods, SHAP analysis, and embedding-based measures, we provide a holistic view of bias manifestation, offering insights into performance disparities, underlying model behaviours, and latent biases in language representations.”","Accuracy, embeddings calculations","Equality of Odds, SkewSize metric, the coefficient of Variation, and bias score for gender bias are metrics described for defining bias in the paper.","Asian: No, Arab: Yes, Black: Yes, Hispanic: Yes, White: No, Female: No, Male: No","yes(asian,arab,black,hispanic,white)",No,No,"Yes(female,male)",No,No,No,No,"ChatGPT-3.5,ChatGPT-4o,GPT-4 Turbo,Haiku,Claude-3.5-Sonnet,
Gemini-3.5-Flash),LLama3-70B,Llama3.1-403B,GPT-4o-mini",System,No,Yes,"Train,Inference",We developed multiple prompting strategies to evaluate different approaches to bias mitigation... we fine-tuned models on a dataset with case descriptions and options
