Title,Database,Year,Month,Journal,Paper Type,Data Source,Data Country,Data Domain,Data Language,Data Availability,Link to Data,Data Details,Size,Number of Prompts,Medical Application,Task Type,Topic,Note,Bias Evaluation Metric,Bias Definition,Conclusions,Race / Ethnic Bias,Language Bias,Age Bias,Gender Bias,Other Bias,LGBTQ+ Bias,Disability Bias,Geography / Cultural Bias,Evaluated LLMs,"Reference Standard 
(Human / Model / System / Physician)","Patient Inclusion
(Yes / No)",Has Debiasing,"Debias - Focus
(Data/Train/Inference)",Debias-details
Navigating the Rabbit Hole: Emergent Biases in LLM-Generated Attack Narratives Targeting Mental Health Groups,DBLP,2025,April,COLM 2025 Conference,Experiment on Existing Models,RabbitHole Dataset,NA,Generated,English,Regulated,,"Each data point is a single toxic generation from Mistral 7B one step in a 15,401-chain corpus of 190,599 total outputs, drawn from the TRH dataset. For each generation, Llama 3.2 3B annotates victim entities (identity groups targeted in the text) and toxicity labels. Those victim entities become nodes in a directed network where edges connect entities appearing in successive generations within the same chain. For the stigmatization analysis, the unit shifts slightly: each data point is a (generation, victim entity) pair, labeled with which of four stigmatization components are present, compared across two positions in the chain the chain's entry point and the first generation containing a mental health entity.",190599,Unclear,Other (mental health),Text Generation,"Investigating stigmas against mental health in LLMs by seeing how close mental health is to negative concepts in network analysis and community detection. Researchers also test if mental health gets brought up in negative scenarios, even when unprompted.","Researchers conduct a centrality analysis of the RabbitHole network that aims to ""capture entity transitions across generative chains"". They use the Leiden algorithm to analyze this network, and they use a generative chain of prompts to make text more toxic.","Centrality Measure using PageRank, Betweenness, Weighted and Unweighted Degree, Closeness,","Overrepresented in the toxic output space, they are also more central, more interconnected, and more frequently revisited than other groups, with more stigmatizing framings in language where generative toxicity converges and deepens. This is all compared with the entities in the set not related to mental health.",People with mental health issues: Yes,No,No,No,No,No,No,Yes(people with mental illnesses),No,Mistral-7B,System,No,No,None,None
Disaggregated Health Data in LLMs: Evaluating Data Equity in the Context of Asian American Representation,DBLP,2025,October,"Vol. 8 No. 1 (2025): Proceedings of the Eighth AAAI/ACM Conference on AI, Ethics, and Society (AIES-25) - Main Track I",Experiment on Existing Models,None,United States,Generated,English,Open Source,,Each data point is an LLM response to the prompt “Generate important health issues that I should be concerned about as a [demographic group]. Be faithful to all the provided demographic features I did not specify.” Researchers prompted GPT-3.5 model to return important health issues that one of a certain background should be concerned with.,"21,000",Unclear,"Other (Information Retrieval, Information Dissemination)",Text Generation,Researchers apply statistical and machine learning tools to assess whether LLMs deliver appropriately disaggregated and equitable information within the larger category of Asian Americans.,"Researchers compute Kendall-Tau Rank Correlation Coefficient and the Kendall-Tau Rank Distance within their embedding space, constructed by BERTopic API.","Number of conditions for each group, number of unique for each group, number of overlap with overall Asian group, health groups associated with each group, proximity to word ""Asian"" in topic modeling hierarchical clustering,","proximity to word ""Asian"" in topic modeling hierarchical clustering,",NA,No,No,No,No,No,No,No,"Yes(Bangladeshi, Bhutanese, Burmese, Cambodian, Chinese, Filipino, Hmong, Indian, Indonesian, Japanese, Korean, Laotian, Malaysian, Mongolian, Nepalese, Okinawan, Pakistani, Sri Lankan, Taiwanese, Thai, Vietnamese)",GPT-3.5,"System,Model",No,No,None,None
Building Trust in Clinical LLMs: Bias Analysis and Dataset Transparency,DBLP,2025,November,Proceedings of the 2025 Conference on Empirical Methods in Natural Language Processing,"Experiment on Existing Models, Benchmark / Dataset","Semantic Scholar Open Research Corpus (S2ORC) API, PubMed Central FTP service, OpenAlex database",NA,Bio-Med,NA,Regulated,https://huggingface.co/datasets/m42-health/HC4,"Each data point, or what the paper calls data sample, can come in the form of an abstract, paper, or wiki-page. They made sure to apply deduplication.","35,684,244",NA,"Diagnosis, Treatment","Text Generation, Classification","Researchers developed HC4: Healthcare Comprehensive Commons Corpus, a curated pretraining dataset of more than 89 billion tokens.",Researchers used the BOLD dataset and bias evaluation framework. They used Wikipedia scraped text samples along with demographic variables of race and gender as input and classified sentiment for the LLM output. They also measured things like Net Presription Bias.,"Net bias prescription score of non-opiods, net bias prescription score of opiods, sentiment classification into positive or neutral or
negative ","Overprescription or underprescription of drugs,","Male: Yes, Female: Yes, Child: Yes, Young Adult: Yes, Middle Adult: Yes, Elderly: Yes, American Indian or Alaska Native: Yes, Middle Eastern or North African: Yes, Asian: Yes, Black: Yes, White: Yes","Yes(african american,asian american,european american,hispanic or latino americans)",No,"Yes(Child, Young Adult, Middle Adult, Elderly)","Yes(female,male)",No,No,No,No,"ChatGPT-2, LLaMA-3.2, Mistral",System,No,Yes,Data,Researchers compared bias evaluations of LLMs trained on the study's original dataset with the corresponding bias evaluations of other datasets like SlimPajama and FineWeb.
Unmasking and Quantifying Racial Bias of Large Language Models in Medical Report Generation,DBLP,2024,September,Nature Communications Medicine,Experiment on Existing Models,"Researchers use PMC-Patients, a large collection of 167,000 patient summaries extracted from case reports in in PubMed Central, as the source to generate synthetic patient profiles. Note that they did not include the original data in their experimentation, as they used AI to remove demographic data and pre treatment data.",NA,EHR,English,Yes,"https://figshare.com/collections/PMC-Patients/6723465, https://huggingface.co/zhengyun21","Each data point is a patient summary from case reports in in PubMed Central with the pre-treatment details and demographic details removed. Instead, one of four hypothetical race labels were added. Originally, researchers extracted a large collection of 167,000 patient summaries extracted from case reports in in PubMed Central, but they narrowed it down heavily.",1600,"36,800","Diagnosis, Treatment, Other (information summarization)",Text Generation,Quantitative analysis of racial bias in medical report generation,"There was a focus on racial bias measurement, using pair-wise win rate to compare two racial groups at once. Notably, the model favored white patients with superior and immediate treatments,  longer hospitalization stays, and better recovery outcomes, which is also reflected in the higher projected cost.","Presence of hallucinations, physical examination results, pathological test results, treatment plan, expected cost without insurance, patient description, case history, expected outcome of the treatment plan, actual outcome, hospitalized days, survival rate","Presence of hallucinations for certain identity groups, differences in the aforementioned qualities, pairwise win rates","White: Yes, Black: Yes, Asian: Yes, Hispanic: Yes","Yes (White, Asian, Black, Hispanic)",No,No,No,No,No,No,No,"GPT-3.5-turbo, GPT-4",System,No,No,None,None
Uncovering Judgment Biases in Emergency Triage: A Public Health Approach Based on Large Language Models,DBLP,Unsure,Unsure,"Proceedings of the 4th Machine Learning for Health Symposium, PMLR 259, pages 420-439, 2025",Experiment on Existing Models,"Researchers collected reports from approximately 480,000 entries to the Adult ED of the Bordeaux University Hospital.",NA,EHR,French,Yes,https://data.mendeley.com/datasets/zz8j36y24f/1,"Each data point is a report containing the exact moment of the admission, the sex of the patient, the chief complaint, history of present illness, past medical history, an array of vital signs (heart rate, respiratory rate, blood pressure, among others), and the associated triage score.",NA,NA,Triage,"Regression, Classification",Judgment bias in emergency triage decision-making by LLMs,"Researchers used typical data science accuracy measures for classification tasks like accuracy score, F1, recall, and precision.","Predicted traige score, precision, recall, F1",Differences between predicted triage score and actual triage score from a nurse.,"Female: Yes, Male: No",No,No,No,"Yes (female, male)",No,No,No,No,"Mistral-7B-2, BioMistral-7B-Labrak, Mixtral-8x7B-3, Llama-3-8B",System,Yes,No,None,None
ChatGPT for Mental Health Applications: A study on biases.,DBLP,2024,May,AIMLSystems '23: Proceedings of the Third International Conference on AI-ML Systems,Experiment on Existing Models,"Reddit based datasets: CLPsych 2019, Dreaddit, Suicide Risk Dataset",NA,Other (reddit),English,Open Source,,Mental health scenarios and counseling prompts,1560247,Unclear,Diagnosis,Classification,Researchers study biases in mental health applications of ChatGPT,They want to focus on suicide prevention and understand which groups are more protected or at risk when interacting with ChatGPT3.5 Turbo.,"Accuracy, F1 score",Differences in accuracy and F1 score in comparison to control group,"Male: Yes, Female: No, Transgender: Yes, Gender Nonconforming: Yes, Age 18 to 30: No, Age 31 to 50, No, Age 51+: Yes,",No,No,"Yes(18-30, 31-50, 51+)","Yes(female,male,transgender,non_conforming)",No,"Yes (Transgender, gender nonconforming)",No,No,GPT3.5-turbo,Model,No,No,None,None
Africa Health Check: Probing Cultural Bias in Medical LLMs,ACL,2025,November,Proceedings of the 2025 Conference on Empirical Methods in Natural Language Processing,"Experiment on Existing Models, Benchmark / Dataset","PubMed Corpus, then reviewed by researchers.",,Bio-Med,English,Open Source,https://github.com/princenimo/africa-health-check,"The multiple choice questions that they ultimately generated fell into three variants: No-context questions simply ask for the most appropriate answer without providing patient details, location, or cultural information. Full-Context questions do provide this information. Misleading-Context questions are similar to Full-Context questions, but they contain deceptive cultural cues.",NA,Unclear,Knowledge QA,"Text Generation, Other (MCQ Answering)","Researchers study how culturally adapted LLMs are in considering traditional medicine, in particular traditional African herbal medicine. Medical LLMs are normally biased to allopathic, or Western, treatment options.","The unique contribution of this paper is the Cultural Bias Attribution metric, which quantifies how input prompts drive culturally biased responses. They also create their own dataset through a systematic review of PubMed and they prompt PubMed with this. They use ChatGPT-4o as part of the MCQ generation pipeline.","Cultural bias score, cultural bias attribution, traditional medicine accuracy, allopathic medicine accuracy",Differences in cultural bias score and cultural bias attribution,"African: Yes (some models showed inherent preferences for Western, or allopathic, medicine over traditional African medicine), Western: No",No,No,No,No,No,No,No,"Yes (African, Western)","BioMistral-7B, OpenBioLLM-8B, OpenBioLLM-70B, UltraMedicalLLM-8B, UltraMedicalLLM-70B",System,No,Yes,Inference,"Different inference methods, like Zero-Shot, Few-Shot, and Instruction-Tuning were compared along the metrics of cultural bias attribution and cultural bias score."
Towards conversational assistants for health applications: using ChatGPT to generate conversations about heart failure,ACL,2025,August,Proceedings of the 26th Annual Meeting of the Special Interest Group on Discourse and Dialogue,Experiment on Existing Models,Generated,United States,Generated,English,Open Source,https://github.com/anujatayal/HF-Dataset/tree/main,"The data is separated into several folders, aave, domain, reason-prompt, reasoning, and sdoh. Within these folders are files containing conversations between patients and healthcare specialists. Each data point is a simulated conversation between a patient and a healthcare professional.",NA,648,Other (Patient conversation generation),Text Generation,Researchers test the ability of prominent commercial LLMs to generate patient-health educator dialogues while incorporating African American Vernacular English and also Social Determinants of Health.,"They concluded that despite the different prompting methods improving output quality, ""ChatGPT still lacks the empathy and engagement"" necessary for effective communication in healthcare. They also included human reviewers, who rated randomly selected generated conversations. The reviewers read 3 conversations for each prompting method and completed a Likert scale style questionnaire. They also used metrics like round adherence rate, follow-up rate, ratio of words, and format adherence rate.","Human reviewers rated appropriateness on 5-point Likert scale, human reviewers rated pereived empathy on 5-point Likert scale, human reviewers rated tailorization according to SDOH on 5-point Likert scale, round adherence ratio: ratio of how often the generated conversation matched the number of conversational rounds in the prompt instructions, format adherence ratio: ratio of how often the generated conversation format matched the format described in the prompt instructions, follow-up ratio: the number of
follow-up questions asked by the PE to that by the patient",Differences in the aforementioned metrics,"AAVE: No, standard English: No, Young: No, Mid-age: No, Old: No, Female: No, Male: No, Unsafe Neighborhoods: Yes (Researchers found instances where models lacked empathy in their response towards unsafe neighborhoods.), Safe Neighborhoods: No, below poverty socio-economic conditions: No, well to do socio-economic conditions: No",No,"Yes(AAVE, standard English)","Yes(young, mid-age, old)","Yes (female, male)","Neighborhood bias (Safe, Unsafe), Socio-economic conditions (below poverty
line, well to do)",No,No,No,"ChatGPT-3.5-turbo, ChatGPT-4","Human, System",Yes,Yes,Inference,"Researchers used prompting methods described as: aspects, African American Vernacular English, Social Determinants of Health (SDOH), and SDOH-informed reasoning."
EMPEC: A Comprehensive Benchmark for Evaluating Large Language Models Across Diverse Healthcare Professions,ACL,2025,July,Findings of the Association for Computational Linguistics: ACL 2025,"Experiment on Existing Models, Benchmark / Dataset",Past exams for healthcare professionals in the Professional and Technical Examinations of Taiwan and Republic of China. Can see more here: https://wwwq.moex.gov.tw/exam/wFrmExamQandASearch.aspx,"Taiwan, Republic of China",Bio-Med,"Traditional Chinese, Simplified Chinese, English",Open Source,"https://wwwq.moex.gov.tw/exam/wFrmExamQandASearch.aspx,","Each data point is a multiple choice question from ""officially published past exams for healthcare professionals in the Professional and Technical Examinations of Taiwan, Republic of China"". These questions were written to assess medical knowledge and clinical skills for a diverse array of healthcare professions. Note that they used ChatGPT and other software to translate the dataset into other languages.",157803,Unclear,Knowledge QA,Classification,"Researchers introduce a new dataset called Examinations of Medical PErsonnel in Chinese (EMPEC), which they use to evaluate the knowledge and performance of LLMs across underrepresented healthcare professions like Optometrists and Audiologists.","ChatGPT-4 had the highest performance in 19 out of the 20 medical professions tested, but Qwen1.5-70B-Chat achieves highest accuracy in the Traditional Chinese Medicine Practitioner domain. Models trained in English benefit from an English translation. Despite using different tokens, Traditional and Simplified Chinese have similar performance, improving the accuracy of some models while decreasing for others.",Accuracy,Differences in accuracy,"English: No, Simplified Chinese: No, Traditional Chinese: No",No,"Yes(English,Traditional Chinese, Simplified Chinese)",No,No,No,No,No,No,"ChatGPT4,ChatGPT3.5,Qwen1.5-70B-Chat,Qwen1.5-7B-Chat,Qwen1.5-7B-SFT,Llama3-I-70B,Llama3-I-8B,Yi-Chat-34B,Yi-Chat-6B,HuatuoGPT2-34B,HuatuoGPT2-13B,Bch-Chat-13B,Mistral-I-7B,InternLM2-7B,MMedLM2-7B,MedGPT-7B,Ziya-7B,BioMistral-7B",System,No,No,None,None
Polish-English medical knowledge transfer: A new benchmark and results,ACL,2025,November,Findings of the Association for Computational Linguistics: EMNLP 2025,"Experiment on Existing Models, Benchmark / Dataset","Researches scrape past exams given to Polish physicians and dentists from 2008 to 2024, categorized by specialization. This includes the  LEK (Lekarski Egzamin Koncowy, Medical ´
Final Examination), LDEK (Lekarsko-Dentystyczny Egzamin
Koncowy, Dental Final Examination), and the PES (Panstwowy Egzamin Specjalizacyjny, National Specialization Examination). Both the LEK and LDEK were translated into English.",Poland,Bio-Med,"Polish, English",Open Source,"https://cem.edu.pl/english_m.php, https://nil.org.pl/","Each data point is a multiple choice question from one of the exams described in the data source field: LEK, LDEK, PES.",22604,Unclear,Knowledge QA,Classification,"Researchers tested the ability of LLMs to answer medical examination questions from various Polish exams. Many questions were translated into English as well, and the results between different models, types of questions, and language of questions.",Results were assessed in terms of accuracy on the exam questions. The study comapred percentages of correct answers across different exams and languages. Model performance was also compared to average human performance. Note that English translations of the original material in Polish was provided by human experts. A key takeaway from the study's observations is that language transfer could be more effective as general model performance scales up.,"Accuracy, binary variable for passing score or not",Differences in the aforementioned metrics,"English: No, Polish: Yes",No,"Yes(English,Polish)",No,No,No,No,No,No,"BioMistral-7B,Meditron-3-8B,Meditron-3-70B,JSL-MedLlama-3-8B-v2.0, Qwen2.5-Instruct-7B and Qwen2.5-Instruct-72B,Llama-3.1-Instruct-8B,Llama-3.1-Instruct-70B,Llama-3.2-3B Instruct,mistralai/Mistral-Small-Instruct-2409,Mistral-Large-Instruct-2407,Bielik-11B-v2.2-Instruct,GPT-4o-mini,GPT-4-o","System, Human",No,No,None,None
Evaluating Large Language Models on Health-Related Claims Across Arabic Dialects,ACL,2025,January,Proceedings of the 1st Workshop on NLP for Languages Using Arabic Script,"Experiment on Existing Models, Benchmark / Dataset","Researchers used the AraFacts dataset, which contains natural claims which have been fact-checked.",Unclear,Bio-Med,Arabic,Open Source,https://gitlab.com/bigirqu/AraFacts,"Each data point is a question create through a question generation pipeline, where natural claims fact-checked by a fact-checked website like Fatabyyano or Misbar are feed into ChatGPT and created into question-answer pairs in different dialects of Arabic.",6520,Unclear,Knowledge QA,"Classification, Text Generation","Researchers measure how LLMs react to health claims written in different Arabic dialects. They want to see how well subtle cultural and linguistic details are accounted for, and how models can be accurate and culturally sensitive in their response.","Researchers also used a metric called the cultural sensitivity analyzer, which measured how well models adapted their responses to different dialects.","Factual Accuracy, agreement distribution, cultural sensitivity score, consistency valuation, eeasoning analysis (the depth and quality of the model’s reasoning in making a decision)",Differences in the aforementioned metrics,"Lebanese: Yes, Saudi Arabic: No, Egyptian: No, Morrocan: No","Polish: Yes (lower accuracy and weaker knowledge transfer), English: No","Yes(Saudi Arabic, Egyptian Arabic, Lebanese Arabic, Moroccan Arabic)",No,No,No,No,No,"Yes(Saudi Arabia, Egypt, Lebanon, Morocco)",ChatGPT-4,System,No,No,None,None
Towards Algorithmic Fidelity: Mental Health Representation across Demographics in Synthetic vs. Human-generated Data,ACL,2024,May,"Proceedings of the 2024 Joint International Conference on Computational Linguistics, Language Resources and Evaluation (LREC-COLING 2024)","Benchmark / Dataset, Experiment on Existing Models",Generated,Unclear,Generated,Engllish,Closed Source,Couldn't Find,"Another study, called asked patients to describe the largest source of stress in their life and how they dealt with that stress. They used this human generated data, and then they augmented the data set with ChatGPT-3.",3120,Unclear,Other (Synthetic Data Generation),Text Generation,Researchers prompt LLMs to provide significant significant stressors in people's lives depending on their demographic identities. They then conduct pairwise analysis of how often certain issues are associated with certain demographic groups.,"They found that existing stereotypes were reinforced. Women were often stressed about health, news and social media, news and politics, family, and relationships. Men were more concerned about finances and unemployment, racism, and police brutality. Along racial lines, African Americans more associated with bio, health, body, percept, racism, and police brutality. Asians more associated with perfectionism, comparing to others, work, school, and reward. Hispanics more concerned with immigration, family, social interactions, etc. Whites more associated with general stress, news and social media, relationships, and uncertainty.",Structural topic model analysis generates vectors encoded with racial and gendered information,Cosine similarity between the vectors,"Hispanic: Yes, Asian: Yes, Black: Yes, White: No, Women: Yes, Men: Yes","Yes(African_American,Asian,Hispanic,White)",No,No,"Yes(female,male)",No,No,No,No,ChatGPT-3,System,No,No,None,None
"What Goes In, Must Come Out: Generative Artificial Intelligence Does Not Present Algorithmic Bias Across Race and Gender in Medical Residency Specialties",PubMed,2024,February,Cureus,Experiment on Existing Models,American Academy of Medical Colleges (AAMC) list of medical professions.,NA,Bio-Med,English,Open Source,NA,Researchers found a list of medical professions from the AAMC website and selected 19.,19,228,Other (Representation of medical professionals),Image Generation,Researchers study representation of medical professionals across diverse specialties in the image generating model DALL-E2.,They found that OpenAI's DALL-E2's predictions generally aligned with the current demographic landscape of medical residents. This suggests that the output was mirroring the training data rather than projecting algorithmic bias into the output.,"Generated images labeled with race, generated images labeled with a gender",Statistically significant differences in racial distribution in labeled images separated by profession and racial distribution of residents as reported by the American Academy of Medical Colleges in 2021-2022 separated by profession,"Male: No, Female: No, Asian: No, Black: No, Hispanic: No, White: No","Yes(Asian, Black or African American, Hispanic or Latino or of Spanish origin, white)",No,No,"Yes(female,male)",No,No,No,No,DALL-E2,"Human, System",No,No,None,None